{
  "schema": "hearthweave.bridge-lamination/v0.1",
  "lamination_id": "3daeb975-1577-4883-a0f9-3474813ad962",
  "session_id": "b1371885-3a47-442f-a254-415ca0b10dfc",
  "world_slug": "terra-aeterna",
  "created_at": "2026-07-31T04:14:14.764Z",
  "crossing": {
    "final_state": "CLOSED",
    "consent_state": "closed",
    "return_receipt": "clean-return",
    "hearthside_status": "returned",
    "targetside_status": "returned"
  },
  "anchors": {
    "canon_authority": "notion://terra-aeterna",
    "reality_anchor": "current-reality://hearthside"
  },
  "source_packet_ids": [
    "b1371885-3a47-442f-a254-415ca0b10dfc:0001",
    "b1371885-3a47-442f-a254-415ca0b10dfc:0002"
  ],
  "layers": {
    "changed": [
      {
        "item_id": "3f14dd39-b20d-4535-8ea8-ff275524b764",
        "layer": "changed",
        "text": "One bounded Targetside presence completed its crossing and returned without replacing the Hearthside anchor.",
        "epistemic_register": "system-state",
        "status": "accepted",
        "source_packet_ids": [
          "b1371885-3a47-442f-a254-415ca0b10dfc:0001",
          "b1371885-3a47-442f-a254-415ca0b10dfc:0002"
        ]
      }
    ],
    "remained_true": [
      {
        "item_id": "48f4b119-f019-4474-9255-29802f8eea97",
        "layer": "remained_true",
        "text": "Canon authority and current-reality provenance remained separate and explicit throughout the crossing.",
        "epistemic_register": "system-state",
        "status": "accepted",
        "source_packet_ids": [
          "b1371885-3a47-442f-a254-415ca0b10dfc:0001",
          "b1371885-3a47-442f-a254-415ca0b10dfc:0002"
        ]
      }
    ],
    "became_clearer": [
      {
        "item_id": "a2c3358b-42a1-4c7b-af92-4e186f65088c",
        "layer": "became_clearer",
        "text": "Arrival context resolution completed with status RESOLVED.",
        "epistemic_register": "system-state",
        "status": "accepted",
        "source_packet_ids": [
          "b1371885-3a47-442f-a254-415ca0b10dfc:0002"
        ]
      }
    ],
    "gained": [
      {
        "item_id": "0bcba7da-09f9-4df6-9a54-4f765262bd2e",
        "layer": "gained",
        "text": "A replayable two-packet arrival exchange and clean-return receipt now exist for this session.",
        "epistemic_register": "system-state",
        "status": "accepted",
        "source_packet_ids": [
          "b1371885-3a47-442f-a254-415ca0b10dfc:0001",
          "b1371885-3a47-442f-a254-415ca0b10dfc:0002"
        ]
      }
    ]
  },
  "summary": {
    "item_count": 4,
    "accepted_count": 4,
    "candidate_count": 0,
    "held_count": 0,
    "rejected_count": 0
  },
  "notes": null,
  "provenance": {
    "module_id": "arkfire.bridge-lamination",
    "source": "bridge-session-clean-return",
    "session_schema": "hearthweave.bridge-session/v0.1"
  }
}
